USUARIO;COD PEDIDO;CEP;CIDADE;UF;BAIRRO;RUA;NUMERO;TIPO;GRUPO TAXA;QT FUNCIONARIOS;FORNECEDOR ATUAL;TX DEBITO;TX CRED ANT;TX 6X;TX 12X;CLIENTE PERC CRED; CLIENTE PERC DEBITO;CLIENTE FAT REAL;NOME EMPRESA;CPF;RAZAO;CNPJ;NOME MAE;DT NASCIMENTO;EMAIL;CELULAR;WHATSAPP;FIXO;OBSERVECOES;MOTIVO;BANCO;AGENCIA;CONTA;QT MINIZINHA;VL MINIZINHA;QT CHIP;VL CHIP;QT PRO;VL PRO;QT SMART;VL SMART
PADRÃO;99;09780370;São Bernardo do Campo;SP;Santa Terezinha;Rua Graciliano Ramos;128;Alimentação e Mercados Especiais;Grande Novo;1;Pagseguro;2.39;4.99;0.0;0.0;6000;8000;2472 Reais;Itália Amália de Oliveira Bomfim;684.966.218-04;;;Júlia Agostinho de Oliveira;1955-12-22;jorgebomfim68@outlook.com;11 97722-1223;11 97722-1223;11 4339-5706;;;;;;0;0;0;0;0;0;1;550,00
PADRÃO;97;39200000;Corinto;MG;Centro;Claudino Caldeira;80 A;Saúde;Grande Novo;4;SumUp;1.90;0.0;0.0;0.0;5000;5000;1344 Reais;Christian Leonardo de Paiva Rosa;00993738664;Karyne de Paiva Rosa Guedes;29495305/0001-01;Venância Maria de Fátima Rosa;;fiasiolifecorinto@gmail.com;38 998001937;38 998001937;38 37511937;Op:003 Resgate automático Vendedor Ramon ;;104;0629;1575-4;0;0;1;135,00;0;0;0;0
PADRÃO;97;39200000;Corinto;MG;Centro;Claudino Caldeira;80 A;Saúde;Grande Novo;4;SumUp;1.90;0.0;0.0;0.0;5000;5000;1344 Reais;Christian Leonardo de Paiva Rosa;00993738664;Karyne de Paiva Rosa Guedes;29495305/0001-01;Venância Maria de Fátima Rosa;;fiasiolifecorinto@gmail.com;38 998001937;38 998001937;38 37511937;Op:003 Resgate automático Vendedor Ramon ;;104;0629;1575-4;0;0;0;0;0;0;1;550,00
PADRÃO;98;39200000;Corinto;MG;Centro;Claudino Caldeira;80 A;Saúde;Grande Novo;3;SumUp;1.90;0.0;0.0;0.0;5000;5000;1344 Reais;Christian Leonardo de Paiva Rosa;009.937.386-64;Caryne de Paiva Rosa Guedes;29.495.305/0001-01;Venância Maria de Fátima Rosa;1976-06-11;fisiolifecorinto@gmail.com ;38 998001937;38 998001937;38 37511937;Conta Corrente Op.: 003 Resgate automático Vendedor Ramon;;104;0006;1575-4;0;0;1;135,00;0;0;0;0
PADRÃO;95;39508000;Jaíba;MG;Residencial Jardins;Rua das Tulipas;250;Vestuário;Grande Novo;1;Cielo;0.0;0.0;0.0;0.0;0;0;0 Reais;Eva Kátia Gomes de Oliveira;11669992624;Eva Katia;;Elidia Gomes de Oliveira ;1991-09-07;evakatia2017@Yahoo.com;38 997498993;38 997498993;;Vendedor: Jefferson França Cliente: Eva Kátia Gomes de Oliveira Banco: Itaú Agência: 5114 Conta Poupança: 11608-9;;341;5114;11608-9;0;0;1;130,00;0;0;0;0
PADRÃO;96;35794-153;Curvelo;MG;Jardim Paraíso;Rua Maria Augusta Pereira Souza;155;Vestuário;G Novo;1;Mercado Pago;0.0;0.0;0.0;0.0;5000;5000;-2712 Reais;Jucelha Maria de Oliveira;10259750654;;;Aparecida Vaz da silva;1988-09-28;jucelhaoliveira8@gmail.com;38999044792;38999044792;;Conta Digital Vendedor Ramon;;;;;0;0;1;135,00;0;0;0;0
Daniel Lourinaldo da Silva;100;29936-804;São Mateus;ES;Cohab;Rua Oito;123;;;1;Cielo;0.0;0.0;0.0;0.0;5000;5000;NaN Reais;;;;;;;;;;;;;;;;0;0;0;0;0;0;0;0
